<?xml version="1.0" encoding="utf-8"?>
<xs:schema xmlns:xs="http://www.w3.org/2001/XMLSchema" elementFormDefault="qualified" attributeFormDefault="unqualified">
	<xs:element name="Equipment">
		<xs:complexType>
			<xs:sequence>
				<xs:element name="Item" maxOccurs="unbounded">
					<xs:complexType>
						<xs:sequence>
							<xs:element name="ApplicationNumber" type="xs:string"/>
							<xs:element name="Description" type="xs:string"/>
							<xs:element name="Location" type="xs:string"/>
							<xs:element name="Name" type="xs:string"/>
							<xs:element name="Year" type="xs:unsignedInt"/>
						</xs:sequence>
						<xs:attribute name="ID" type="xs:unsignedInt" use="required"/>
					</xs:complexType>
				</xs:element>
			</xs:sequence>
		</xs:complexType>
	</xs:element>
</xs:schema>
